,Unnamed: 0,firm,date_review,job_title,current,location,overall_rating,work_life_balance,culture_values,diversity_inclusion,career_opp,comp_benefits,senior_mgmt,recommend,ceo_approv,outlook,headline,pros,cons,year,pros_clean_min,pros_clean_lemma_only,pros_clean_with_stopwords,pros_clean_with_symspell,cons_clean_min,cons_clean_lemma_only,cons_clean_with_stopwords,cons_clean_with_symspell,Marie's pros,Marie's cons,Javi's pros,Javi's cons,Chat's pros,Chat's cons,min_pro_aspect_sentiments,min_con_aspect_sentiments,lemma_pro_aspect_sentiments,lemma_con_aspect_sentiments,Stopword_pro_aspect_sentiments,Stopword_con_aspect_sentiments,Symspell_pro_aspect_sentiments,Symspell_con_aspect_sentiments
69276,702496,REED,11/26/19,Screening Executive,"Former Employee, more than 1 year","Manchester, England, England",3,5,4,,1,2,2,o,o,o,"Great People, Poor Management","Good company culture
 
 Great Staff
 
 Plenty of training","No opportunity to progress
 
 Management would never listen to advice",2019,Good company culture Great Staff Plenty of training,good company culture great staff plenty of training,good company culture great staff plenty training,good company culture great staff plenty train,No opportunity to progress Management would never listen to advice,no opportunity to progress management would never listen to advice,opportunity progress management listen advice,opportunity progress management listen advice,"culture: 3; people: 4; growth & learning: 2
",management: 2,culture: 4; people: 4; hr & recruitment: 3,management: 1; growth & learning: 1,culture:5; people:5; growth & learning:5,growth & learning:1; management:1,"{'culture': {1: 0.0034788984, 2: 0.0054067383, 3: 0.082986124, 4: 0.4798303, 5: 0.42829794, 'label': 4}, 'hr & recruitment': {1: 0.0033305588, 2: 0.004996815, 3: 0.07487787, 4: 0.47070378, 5: 0.44609103, 'label': 4}}","{'growth & learning': {1: 0.5737395, 2: 0.29524928, 3: 0.10122949, 4: 0.020898521, 5: 0.008883167, 'label': 1}, 'management': {1: 0.68162537, 2: 0.2307316, 3: 0.0691221, 4: 0.012586329, 5: 0.0059345807, 'label': 1}}","{'culture': {1: 0.0034788984, 2: 0.0054067383, 3: 0.082986124, 4: 0.4798303, 5: 0.42829794, 'label': 4}, 'hr & recruitment': {1: 0.0033305588, 2: 0.004996815, 3: 0.07487787, 4: 0.47070378, 5: 0.44609103, 'label': 4}}","{'growth & learning': {1: 0.5737395, 2: 0.29524928, 3: 0.10122949, 4: 0.020898521, 5: 0.008883167, 'label': 1}, 'management': {1: 0.68162537, 2: 0.2307316, 3: 0.0691221, 4: 0.012586329, 5: 0.0059345807, 'label': 1}}","{'culture': {1: 0.004055351, 2: 0.00635515, 3: 0.09486256, 4: 0.48747918, 5: 0.40724778, 'label': 4}, 'hr & recruitment': {1: 0.003773098, 2: 0.0055837277, 3: 0.083060905, 4: 0.47592336, 5: 0.43165886, 'label': 4}}","{'growth & learning': {1: 0.2823614, 2: 0.25319374, 3: 0.2616081, 4: 0.13833106, 5: 0.06450574, 'label': 1}, 'management': {1: 0.3221728, 2: 0.24472935, 3: 0.24836141, 4: 0.123068035, 5: 0.06166839, 'label': 1}}","{'culture': {1: 0.0050760508, 2: 0.007857931, 3: 0.09929264, 4: 0.4591974, 5: 0.42857593, 'label': 4}, 'hr & recruitment': {1: 0.004813908, 2: 0.007101535, 3: 0.0897006, 4: 0.44990754, 5: 0.44847637, 'label': 4}}","{'growth & learning': {1: 0.2823614, 2: 0.25319374, 3: 0.2616081, 4: 0.13833106, 5: 0.06450574, 'label': 1}, 'management': {1: 0.3221728, 2: 0.24472935, 3: 0.24836141, 4: 0.123068035, 5: 0.06166839, 'label': 1}}"
26840,164462,Cygnet Health Care,11/3/19,Support Worker,"Former Employee, more than 1 year","Leeds, England, England",1,1,1,,1,1,1,x,x,x,Stay away,Wage. Free meals. Some staff have your back.,"Training
 
 Management
 
 Long 12 hour shifts
 
 Not enough staff cover for shifts",2019,Wage. Free meals. Some staff have your back.,wage free meal some staff have your back,wage free meal staff,wage free meal staff,Training Management Long 12 hour shifts Not enough staff cover for shifts,training management long 12 hour shift not enough staff cover for shift,training management long 12 hour shift staff cover shift,train management long hour shift staff cover shift,pay: 3; perks & benefits:4; people:3,growth & learning: 2; management: 2; work-life balance: 1,pay: 4; perks & benefits: 4; people: 3,hr & recruitment: 2; management: 2; stress & pressure: 1,pay:5; perks & benefits:5; people:5,growth & learning:1; management:1; stress & pressure:1; people:1,"{'perks & benefits': {1: 0.008009312, 2: 0.016630063, 3: 0.20149902, 4: 0.5210029, 5: 0.2528587, 'label': 4}, 'hr & recruitment': {1: 0.009095461, 2: 0.018607754, 3: 0.19470967, 4: 0.5062428, 5: 0.27134433, 'label': 4}, 'pay': {1: 0.015067871, 2: 0.026789624, 3: 0.21127154, 4: 0.47176322, 5: 0.27510774, 'label': 4}}","{'hr & recruitment': {1: 0.39500883, 2: 0.33481845, 3: 0.17899759, 4: 0.06517465, 5: 0.026000476, 'label': 1}, 'management': {1: 0.45230678, 2: 0.31569114, 3: 0.16217232, 4: 0.049924664, 5: 0.019905137, 'label': 1}, 'work-life balance': {1: 0.33149034, 2: 0.3340212, 3: 0.2161063, 4: 0.08583181, 5: 0.032550383, 'label': 2}}","{'perks & benefits': {1: 0.015445125, 2: 0.020404076, 3: 0.18121313, 4: 0.48149353, 5: 0.30144414, 'label': 4}, 'hr & recruitment': {1: 0.01992179, 2: 0.025203954, 3: 0.18832104, 4: 0.4609813, 5: 0.30557182, 'label': 4}, 'pay': {1: 0.035377458, 2: 0.039121073, 3: 0.21376199, 4: 0.427709, 5: 0.28403044, 'label': 4}}","{'hr & recruitment': {1: 0.40036467, 2: 0.3214462, 3: 0.1830035, 4: 0.06806885, 5: 0.027116776, 'label': 1}, 'management': {1: 0.45893422, 2: 0.30646452, 3: 0.16420932, 4: 0.05056664, 5: 0.019825352, 'label': 1}, 'work-life balance': {1: 0.33343202, 2: 0.32213864, 3: 0.22174549, 4: 0.0895613, 5: 0.033122584, 'label': 1}}","{'perks & benefits': {1: 0.009333315, 2: 0.0133089, 3: 0.16159447, 4: 0.5080881, 5: 0.30767524, 'label': 4}, 'hr & recruitment': {1: 0.011674125, 2: 0.015675206, 3: 0.15761098, 4: 0.48683935, 5: 0.32820037, 'label': 4}, 'pay': {1: 0.019014286, 2: 0.024810363, 3: 0.18970686, 4: 0.4655176, 5: 0.30095088, 'label': 4}}","{'hr & recruitment': {1: 0.3491206, 2: 0.29421556, 3: 0.20993331, 4: 0.09997609, 5: 0.046754446, 'label': 1}, 'management': {1: 0.4061153, 2: 0.27882007, 3: 0.19184192, 4: 0.083335556, 5: 0.03988727, 'label': 1}, 'work-life balance': {1: 0.29834142, 2: 0.2842054, 3: 0.23976533, 4: 0.122633085, 5: 0.055054773, 'label': 1}}","{'perks & benefits': {1: 0.009333315, 2: 0.0133089, 3: 0.16159447, 4: 0.5080881, 5: 0.30767524, 'label': 4}, 'hr & recruitment': {1: 0.011674125, 2: 0.015675206, 3: 0.15761098, 4: 0.48683935, 5: 0.32820037, 'label': 4}, 'pay': {1: 0.019014286, 2: 0.024810363, 3: 0.18970686, 4: 0.4655176, 5: 0.30095088, 'label': 4}}","{'hr & recruitment': {1: 0.36005586, 2: 0.2911683, 3: 0.21099158, 4: 0.094836585, 5: 0.042947643, 'label': 1}, 'management': {1: 0.41440934, 2: 0.26973617, 3: 0.1937274, 4: 0.082570866, 5: 0.039556243, 'label': 1}, 'work-life balance': {1: 0.2930861, 2: 0.28360966, 3: 0.2504457, 4: 0.12115895, 5: 0.051699676, 'label': 1}}"
3638,23032,Amey,6/6/16,Commercial Manager,"Former Employee, more than 1 year","Oxford, England, England",3,4,3,,2,1,1,x,r,r,Average,"Job security, working for big clients, decent company car scheme.","Some of the upper management are unqualified to do their jobs, promotions based on who you know not what you know, the salary was awful I was on £10k less than the market average and was told there was no money in the budget for pay rises. Some of the directors are rude and arrogant.",2016,"Job security, working for big clients, decent company car scheme.",job security work for big client decent company car scheme,job security work big client decent company car scheme,job security work big client decent company car scheme,"Some of the upper management are unqualified to do their jobs, promotions based on who you know not what you know, the salary was awful I was on 10k less than the market average and was told there was no money in the budget for pay rises. Some of the directors are rude and arrogant.",some of the upper management be unqualified to do their job promotion base on who you know not what you know the salary be awful I be on £ 10k less than the market average and be tell there be no money in the budget for pay rise some of the director be rude and arrogant,upper management unqualified job promotion base know know salary awful £ 10k market average tell money budget pay rise director rude arrogant,upper management unqualified job promotion base know know salary awful 10k market average tell money budget pay rise director rude arrogant,job security: 4,management: 2; pay: 2,job security: 4; perks & benefits: 4,management: 1; growth & learning: 1; pay: 1; culture: 1,job security:5; office & location:5; perks & benefits:5,management:1; pay:1; culture:1,"{'job security': {1: 0.0072697974, 2: 0.016323868, 3: 0.21405816, 4: 0.52891046, 5: 0.23343764, 'label': 4}}","{'growth & learning': {1: 0.64102614, 2: 0.30324644, 3: 0.045376018, 4: 0.0071522202, 5: 0.0031991436, 'label': 1}, 'management': {1: 0.68112504, 2: 0.27151993, 3: 0.038793903, 4: 0.005868535, 5: 0.002692611, 'label': 1}, 'pay': {1: 0.6836322, 2: 0.26506907, 3: 0.041035205, 4: 0.0069309836, 5: 0.0033325546, 'label': 1}}","{'job security': {1: 0.013766262, 2: 0.022431683, 3: 0.2149988, 4: 0.48870155, 5: 0.2601017, 'label': 4}}","{'growth & learning': {1: 0.5918434, 2: 0.30379662, 3: 0.08361015, 4: 0.014981486, 5: 0.0057683415, 'label': 1}, 'management': {1: 0.6215736, 2: 0.28251585, 3: 0.07799268, 4: 0.012890566, 5: 0.005027247, 'label': 1}, 'pay': {1: 0.6324825, 2: 0.27190107, 3: 0.076479405, 4: 0.013587031, 5: 0.005550066, 'label': 1}}","{'job security': {1: 0.008279383, 2: 0.015149854, 3: 0.17986405, 4: 0.5026304, 5: 0.2940763, 'label': 4}}","{'growth & learning': {1: 0.7556902, 2: 0.19446202, 3: 0.040881842, 4: 0.0060777892, 5: 0.0028881575, 'label': 1}, 'management': {1: 0.77756584, 2: 0.17525147, 3: 0.038340744, 4: 0.005900174, 5: 0.0029417991, 'label': 1}, 'pay': {1: 0.78508264, 2: 0.16827066, 3: 0.03723197, 4: 0.006239714, 5: 0.0031749653, 'label': 1}}","{'job security': {1: 0.008279383, 2: 0.015149854, 3: 0.17986405, 4: 0.5026304, 5: 0.2940763, 'label': 4}}","{'growth & learning': {1: 0.7492333, 2: 0.19935885, 3: 0.041871604, 4: 0.0064595337, 5: 0.00307661, 'label': 1}, 'management': {1: 0.77952194, 2: 0.17509663, 3: 0.036786716, 4: 0.0057207425, 5: 0.0028739157, 'label': 1}, 'pay': {1: 0.7866103, 2: 0.16830975, 3: 0.035894427, 4: 0.0060662394, 5: 0.0031192855, 'label': 1}}"
79547,774034,The White Company,2/25/21,Sales Associate,"Former Employee, less than 1 year","London, England, England",3,2,3,3,3,3,3,o,o,r,Reasonable but not for the long term,"- Smaller personable teams 
 
 - Good employee perks (50% discount)","- Small teams = a lot more responsibility for what you're being paid 
 
 - Lots of product knowledge required 
 
 - Unfavorable hours",2021,- Smaller personable teams - Good employee perks (50% discount),small personable team good employee perk 50 discount,small personable team good employee perk 50 discount,small personable team good employee perk discount,- Small teams = a lot more responsibility for what you're being paid - Lots of product knowledge required - Unfavorable hours,small team = a lot more responsibility for what you be be pay lot of product knowledge require unfavorable hour,small team = lot responsibility pay lot product knowledge require unfavorable hour,small team lot responsibility pay lot product knowledge require unfavorable hour,perks & benefits: 4; teamwork & collaboration: 3,pay: 2; work-life balance: 2,perks & benefits: 4; teamwork & collaboration: 4,pay: 2; work-life balance: 2,people:5; perks & benefits:5,stress & pressure:1; pay:1; growth & learning:1,"{'perks & benefits': {1: 0.013993757, 2: 0.029724674, 3: 0.25777662, 4: 0.5310013, 5: 0.16750367, 'label': 4}, 'teamwork & collaboration': {1: 0.014072618, 2: 0.032198064, 3: 0.2702984, 4: 0.5354221, 5: 0.14800882, 'label': 4}}","{'growth & learning': {1: 0.36426693, 2: 0.48296443, 3: 0.1352444, 4: 0.014330937, 5: 0.0031932546, 'label': 2}, 'job role clarity': {1: 0.31583118, 2: 0.48716557, 3: 0.17216267, 4: 0.020717092, 5: 0.0041235653, 'label': 2}, 'pay': {1: 0.4531093, 2: 0.41911435, 3: 0.11078511, 4: 0.013407316, 5: 0.0035838836, 'label': 1}, 'teamwork & collaboration': {1: 0.3765693, 2: 0.4698447, 3: 0.13388105, 4: 0.01607822, 5: 0.0036267398, 'label': 2}, 'work-life balance': {1: 0.3581585, 2: 0.4822054, 3: 0.1404032, 4: 0.015719065, 5: 0.0035138628, 'label': 2}}","{'perks & benefits': {1: 0.012657938, 2: 0.020624956, 3: 0.21291935, 4: 0.5348475, 5: 0.21895024, 'label': 4}, 'teamwork & collaboration': {1: 0.015716268, 2: 0.027581211, 3: 0.23910142, 4: 0.52347606, 5: 0.19412506, 'label': 4}}","{'growth & learning': {1: 0.38310325, 2: 0.40112275, 3: 0.17159763, 4: 0.033178262, 5: 0.010998084, 'label': 2}, 'job role clarity': {1: 0.33568117, 2: 0.3996525, 3: 0.21127254, 4: 0.041726977, 5: 0.01166675, 'label': 2}, 'pay': {1: 0.43720436, 2: 0.36226693, 3: 0.15819079, 4: 0.031402554, 5: 0.010935363, 'label': 1}, 'teamwork & collaboration': {1: 0.39892533, 2: 0.38792726, 3: 0.16728513, 4: 0.034596164, 5: 0.011266088, 'label': 1}}","{'perks & benefits': {1: 0.012657938, 2: 0.020624956, 3: 0.21291935, 4: 0.5348475, 5: 0.21895024, 'label': 4}, 'teamwork & collaboration': {1: 0.015716268, 2: 0.027581211, 3: 0.23910142, 4: 0.52347606, 5: 0.19412506, 'label': 4}}","{'growth & learning': {1: 0.4781299, 2: 0.33332637, 3: 0.14758082, 4: 0.030202745, 5: 0.010760169, 'label': 1}, 'job role clarity': {1: 0.40321535, 2: 0.33138058, 3: 0.20153104, 4: 0.04869127, 5: 0.015181753, 'label': 1}, 'pay': {1: 0.47196603, 2: 0.3095499, 3: 0.16163154, 4: 0.040718637, 5: 0.016133856, 'label': 1}, 'teamwork & collaboration': {1: 0.47481748, 2: 0.3255375, 3: 0.15250228, 4: 0.03501729, 5: 0.012125408, 'label': 1}}","{'perks & benefits': {1: 0.0137561755, 2: 0.023331888, 3: 0.23897853, 4: 0.5283374, 5: 0.19559593, 'label': 4}, 'teamwork & collaboration': {1: 0.01743467, 2: 0.03192576, 3: 0.2694878, 4: 0.51262563, 5: 0.16852611, 'label': 4}}","{'growth & learning': {1: 0.4580786, 2: 0.33766496, 3: 0.15766887, 4: 0.034026675, 5: 0.01256101, 'label': 1}, 'job role clarity': {1: 0.38411427, 2: 0.32739955, 3: 0.21667153, 4: 0.054563902, 5: 0.017250732, 'label': 1}, 'pay': {1: 0.45245206, 2: 0.31123185, 3: 0.17254905, 4: 0.04568168, 5: 0.018085254, 'label': 1}, 'teamwork & collaboration': {1: 0.45792985, 2: 0.3218614, 3: 0.1656395, 4: 0.04029233, 5: 0.014276958, 'label': 1}}"
73653,741819,Sanctuary Group,4/20/21,Anonymous Employee,"Current Employee, more than 8 years","Worcester, England, England",4,5,4,4,3,4,4,v,v,v,Great company,"Great team, interesting work and supportive work environment. Good family friendly policies",More modernisation of workplace (but is happening) less bureaucracy,2021,"Great team, interesting work and supportive work environment. Good family friendly policies",great team interesting work and supportive work environment good family friendly policy,great team interesting work supportive work environment good family friendly policy,great team interesting work supportive work environment good family friendly policy,More modernisation of workplace (but is happening) less bureaucracy,more modernisation of workplace but be happen less bureaucracy,modernisation workplace happen bureaucracy,modernisation workplace happen bureaucracy,people: 4; culture: 4; work-life balance: 3,tools & resources: 2; management: 2,people: 4; culture: 4; work-life balance: 4,management: 2; tools & resources: 2,people:5; culture:5; teamwork & collaboration:5,office & location:1; stress & pressure:1,"{'culture': {1: 0.002504707, 2: 0.0039416337, 3: 0.07742405, 4: 0.5466789, 5: 0.3694507, 'label': 4}, 'hr & recruitment': {1: 0.0025951893, 2: 0.003943303, 3: 0.0709237, 4: 0.5338032, 5: 0.38873455, 'label': 4}, 'teamwork & collaboration': {1: 0.0022507412, 2: 0.003559324, 3: 0.07325542, 4: 0.55751026, 5: 0.3634243, 'label': 4}, 'tools & resources': {1: 0.0023772216, 2: 0.0037687807, 3: 0.07022829, 4: 0.549444, 5: 0.37418166, 'label': 4}}","{'management': {1: 0.31229523, 2: 0.40085447, 3: 0.22798012, 4: 0.04705987, 5: 0.011810279, 'label': 2}, 'office & location': {1: 0.248112, 2: 0.3899724, 3: 0.2795765, 4: 0.06679612, 5: 0.015543038, 'label': 2}}","{'culture': {1: 0.0027137813, 2: 0.004009588, 3: 0.07468216, 4: 0.530912, 5: 0.3876825, 'label': 4}, 'teamwork & collaboration': {1: 0.0029089595, 2: 0.004667956, 3: 0.08919821, 4: 0.55389357, 5: 0.34933138, 'label': 4}, 'tools & resources': {1: 0.0027288015, 2: 0.0042276825, 3: 0.075915314, 4: 0.5424899, 5: 0.3746383, 'label': 4}}","{'management': {1: 0.29056615, 2: 0.35999197, 3: 0.2604104, 4: 0.07123093, 5: 0.017800605, 'label': 2}, 'office & location': {1: 0.22917052, 2: 0.34359396, 3: 0.31000286, 4: 0.095534846, 5: 0.021697836, 'label': 2}}","{'culture': {1: 0.0031102598, 2: 0.004796899, 3: 0.087699704, 4: 0.54621214, 5: 0.35818097, 'label': 4}, 'teamwork & collaboration': {1: 0.0033857508, 2: 0.005714035, 3: 0.10605709, 4: 0.5654476, 5: 0.3193955, 'label': 4}, 'tools & resources': {1: 0.0031184938, 2: 0.0050576297, 3: 0.08900579, 4: 0.55559224, 5: 0.34722587, 'label': 4}}","{'management': {1: 0.38289922, 2: 0.27925858, 3: 0.19776979, 4: 0.09340963, 5: 0.046662867, 'label': 1}, 'office & location': {1: 0.34698117, 2: 0.28578326, 3: 0.22143432, 4: 0.1021451, 5: 0.04365618, 'label': 1}}","{'culture': {1: 0.0031102598, 2: 0.004796899, 3: 0.087699704, 4: 0.54621214, 5: 0.35818097, 'label': 4}, 'teamwork & collaboration': {1: 0.0033857508, 2: 0.005714035, 3: 0.10605709, 4: 0.5654476, 5: 0.3193955, 'label': 4}, 'tools & resources': {1: 0.0031184938, 2: 0.0050576297, 3: 0.08900579, 4: 0.55559224, 5: 0.34722587, 'label': 4}}","{'management': {1: 0.38289922, 2: 0.27925858, 3: 0.19776979, 4: 0.09340963, 5: 0.046662867, 'label': 1}, 'office & location': {1: 0.34698117, 2: 0.28578326, 3: 0.22143432, 4: 0.1021451, 5: 0.04365618, 'label': 1}}"
4218,23989,Anglo American,8/11/20,Talent Acquisition Specialist,Current Employee,"London, England, England",5,5,5,,5,5,5,o,v,o,Amazing Company to work for !,"Anglo American is an organisation that looks after its people so much and put their safety both physical and mental at first always and, your coworkers make it even better. It is also an organisation that offers great career progression and work/balance. 
 
 Really proud of working here!",I have not experienced any problems,2020,"Anglo American is an organisation that looks after its people so much and put their safety both physical and mental at first always and, your coworkers make it even better. It is also an organisation that offers great career progression and work/balance. Really proud of working here!",anglo american be an organisation that look after its people so much and put their safety both physical and mental at first always and your coworker make it even well it be also an organisation that offer great career progression and work balance really proud of work here,anglo american organisation look people safety physical mental coworker well organisation offer great career progression work balance proud work,anglo american organisation look people safety physical mental coworker well organisation offer great career progression work balance proud work,I have not experienced any problems,I have not experience any problem,experience problem,experience problem,culture: 4; people: 4: growth & learning:5; work-life balance:5,,culture: 5; people: 5; growth & learning: 5; work-life balance: 5,,people:5; job security:5; work-life balance:5; growth & learning:5,,"{'growth & learning': {1: 0.0015721207, 2: 0.0015734497, 3: 0.013837414, 4: 0.21879867, 5: 0.7642184, 'label': 5}, 'job security': {1: 0.001709472, 2: 0.001697138, 3: 0.013110109, 4: 0.21368396, 5: 0.76979935, 'label': 5}, 'people': {1: 0.0018055603, 2: 0.001774634, 3: 0.013217662, 4: 0.19639798, 5: 0.7868041, 'label': 5}, 'work-life balance': {1: 0.002166624, 2: 0.0024033077, 3: 0.01922397, 4: 0.23641787, 5: 0.73978823, 'label': 5}}",{},"{'growth & learning': {1: 0.004028653, 2: 0.004717466, 3: 0.038681127, 4: 0.31161994, 5: 0.6409528, 'label': 5}, 'job security': {1: 0.004848802, 2: 0.0055408604, 3: 0.039453693, 4: 0.3026257, 5: 0.647531, 'label': 5}, 'people': {1: 0.0049442044, 2: 0.0056073177, 3: 0.039426345, 4: 0.28922445, 5: 0.6607978, 'label': 5}, 'work-life balance': {1: 0.00557206, 2: 0.0067467215, 3: 0.049129136, 4: 0.31181398, 5: 0.62673813, 'label': 5}}",{},"{'growth & learning': {1: 0.0056875385, 2: 0.007633895, 3: 0.09329904, 4: 0.47203052, 5: 0.421349, 'label': 4}, 'job security': {1: 0.0068533453, 2: 0.009278591, 3: 0.09898585, 4: 0.46834406, 5: 0.41653818, 'label': 4}, 'people': {1: 0.008432814, 2: 0.011303791, 3: 0.10890184, 4: 0.45325384, 5: 0.4181077, 'label': 4}, 'work-life balance': {1: 0.008744672, 2: 0.011511626, 3: 0.10241794, 4: 0.4281772, 5: 0.44914854, 'label': 5}}",{},"{'growth & learning': {1: 0.0056875385, 2: 0.007633895, 3: 0.09329904, 4: 0.47203052, 5: 0.421349, 'label': 4}, 'job security': {1: 0.0068533453, 2: 0.009278591, 3: 0.09898585, 4: 0.46834406, 5: 0.41653818, 'label': 4}, 'people': {1: 0.008432814, 2: 0.011303791, 3: 0.10890184, 4: 0.45325384, 5: 0.4181077, 'label': 4}, 'work-life balance': {1: 0.008744672, 2: 0.011511626, 3: 0.10241794, 4: 0.4281772, 5: 0.44914854, 'label': 5}}",{}
41641,308059,HM Prison Service,2/25/19,Supervising Officer,"Former Employee, more than 10 years","Nottingham, England, England",1,1,1,,1,1,1,x,x,r,Offender supervisor,its what you make of it.,"poor working conditions, unsupportive management structure. If you dont mind being assaulted on a regular basis by having excrement thrown over you or verbally abused on a daily basis this is not for you. oh and not forgetting the prisoners don't like you either.",2019,its what you make of it.,its what you make of it,,,"poor working conditions, unsupportive management structure. If you dont mind being assaulted on a regular basis by having excrement thrown over you or verbally abused on a daily basis this is not for you. oh and not forgetting the prisoners don't like you either.",poor working condition unsupportive management structure if you do not mind be assault on a regular basis by have excrement throw over you or verbally abuse on a daily basis this be not for you oh and not forget the prisoner do not like you either,poor working condition unsupportive management structure not mind assault regular basis have excrement throw verbally abuse daily basis oh forget prisoner like,poor work condition unsupportive management structure mind assault regular basis have excrement throw verbally abuse daily basis forget prisoner like,,management: 1; culture: 1,,management: 1; culture: 1; people: 1,people:5,management:1; stress & pressure:1; teamwork & collaboration:1; culture:1,{},"{'hr & recruitment': {1: 0.6766355, 2: 0.28815287, 3: 0.031081758, 4: 0.0028629133, 5: 0.0012669594, 'label': 1}, 'management': {1: 0.69061464, 2: 0.2768593, 3: 0.028921325, 4: 0.00249313, 5: 0.0011116433, 'label': 1}, 'pay': {1: 0.72243994, 2: 0.24795343, 3: 0.02606985, 4: 0.0023929866, 5: 0.0011437905, 'label': 1}, 'teamwork & collaboration': {1: 0.662056, 2: 0.3020392, 3: 0.031839754, 4: 0.0028429725, 5: 0.0012220781, 'label': 1}, 'tools & resources': {1: 0.7033458, 2: 0.26770082, 3: 0.025577823, 4: 0.0023025041, 5: 0.0010730261, 'label': 1}}",{},"{'hr & recruitment': {1: 0.7562087, 2: 0.2125582, 3: 0.027725404, 4: 0.0024560476, 5: 0.0010516399, 'label': 1}, 'management': {1: 0.7632732, 2: 0.20602201, 3: 0.027355982, 4: 0.0023545302, 5: 0.0009942476, 'label': 1}, 'teamwork & collaboration': {1: 0.73087484, 2: 0.2334434, 3: 0.031767197, 4: 0.0028147814, 5: 0.0010997395, 'label': 1}, 'tools & resources': {1: 0.7642043, 2: 0.2069069, 3: 0.025646996, 4: 0.0022683288, 5: 0.0009735188, 'label': 1}}",{},"{'hr & recruitment': {1: 0.76354694, 2: 0.19586329, 3: 0.034165163, 4: 0.0044581536, 5: 0.001966449, 'label': 1}, 'management': {1: 0.7881833, 2: 0.17715666, 3: 0.029479465, 4: 0.0035714603, 5: 0.0016091085, 'label': 1}, 'teamwork & collaboration': {1: 0.7453464, 2: 0.2101883, 3: 0.037476968, 4: 0.0049732686, 5: 0.002015094, 'label': 1}, 'tools & resources': {1: 0.77706623, 2: 0.18656363, 3: 0.030573964, 4: 0.0039832103, 5: 0.0018129249, 'label': 1}}",{},"{'hr & recruitment': {1: 0.7620409, 2: 0.19585602, 3: 0.034691073, 4: 0.00503226, 5: 0.0023797397, 'label': 1}, 'management': {1: 0.7809146, 2: 0.18190025, 3: 0.030990237, 4: 0.0041853455, 5: 0.0020096076, 'label': 1}, 'teamwork & collaboration': {1: 0.7447573, 2: 0.20948203, 3: 0.03771161, 4: 0.0055957274, 5: 0.002453361, 'label': 1}, 'tools & resources': {1: 0.77481616, 2: 0.18809022, 3: 0.03070676, 4: 0.0043063588, 5: 0.0020805183, 'label': 1}}"
